{
  "schema_version": "0.1.0",
  "ave_evidence_schema_version": "1.0.0",
  "export_id": "ln_0123456789abcdef",
  "created_at": "2026-08-05T12:00:00Z",
  "device": {
    "product": "Lumenate Nova",
    "app_package": "com.lumenate.lumenateaa",
    "app_version": "7.0.0",
    "app_version_code": 380,
    "firmware_version": null
  },
  "session": {
    "session_id": "sanitized-fixture",
    "title": null,
    "duration_ms": 1000
  },
  "segments": [
    {
      "segment_id": "segment-001",
      "start_ms": 0,
      "end_ms": 1000,
      "intensity": null,
      "color_rgb": null,
      "pulse": null,
      "command_ids": [],
      "evidence_ids": ["ave_0123456789abcdef"]
    }
  ],
  "commands": [],
  "sync_anchors": [],
  "provenance": {
    "source_hashes": [
      {
        "source_id": "base-apk-v7.0.0",
        "sha256": "2ad4a6d313ca425023aba1864a51db87a0f2d38e697af2244fc42260d3136857"
      }
    ],
    "acquisition_notes": ["Synthetic contract fixture; not a reconstructed session."]
  },
  "confidence": {
    "level": "L1",
    "score": 0.5,
    "method": "Fixture value used only to exercise the integration contract."
  },
  "limitations": ["Contains no interpreted device commands or physical validation."],
  "ave_evidence": [
    {
      "schema_version": "1.0.0",
      "evidence_id": "ave_0123456789abcdef",
      "evidence_level": "measurement",
      "evidence_type": "fixture_segment_duration",
      "source_module": "lumenate_nova.contract_fixture",
      "summary": "Synthetic segment duration for contract validation.",
      "scope": {
        "channels": ["light"],
        "time_range_seconds": {"start": 0.0, "end": 1.0}
      },
      "measurements": [
        {"name": "duration", "value": 1000, "unit": "ms"}
      ],
      "context": {"synthetic": true},
      "confidence": {"score": 0.5, "method": "Synthetic fixture"},
      "provenance": {"source_id": "contract-fixture"},
      "supporting_evidence_ids": [],
      "limitations": ["Not empirical evidence."]
    }
  ]
}
